{
  "lastChecked": "2026-04-14",
  "robotsTxt": {
    "valid": true,
    "allowsGPTBot": true,
    "allowsPerplexityBot": true,
    "allowsClaudeBot": true,
    "allowsGooglebot": true,
    "allowsBingbot": true,
    "lastModified": "2026-04-07"
  },
  "sitemapXml": {
    "valid": true,
    "totalUrls": 19,
    "lastSubmitted": "2026-04-07",
    "googleFetchStatus": "pending",
    "bingFetchStatus": "not-submitted"
  },
  "llmsTxt": {
    "exists": true,
    "sizeBytes": 1842,
    "crawlsThisWeek": 12,
    "lastCrawledBy": "PerplexityBot"
  },
  "llmsFullTxt": {
    "exists": true,
    "sizeBytes": 8234,
    "crawlsThisWeek": 8,
    "lastCrawledBy": "GPTBot"
  },
  "feedXml": {
    "valid": true,
    "itemCount": 17,
    "lastBuildDate": "2026-04-07"
  },
  "pages": [
    { "url": "/", "googleIndexed": true, "bingIndexed": true, "lastCrawled": "2026-04-12" },
    { "url": "/research", "googleIndexed": true, "bingIndexed": false, "lastCrawled": "2026-04-11" },
    { "url": "/articles/rag-long-context-infrastructure-shift-2026.html", "googleIndexed": true, "bingIndexed": false, "lastCrawled": "2026-04-10" },
    { "url": "/articles/aethir-decentralized-infrastructure-vs-cloud-2026.html", "googleIndexed": true, "bingIndexed": false, "lastCrawled": "2026-04-09" },
    { "url": "/articles/security-openclaw-exposure-2026.html", "googleIndexed": true, "bingIndexed": false, "lastCrawled": "2026-04-08" },
    { "url": "/articles/ai-reasoning-inference-scaling-2026.html", "googleIndexed": true, "bingIndexed": false, "lastCrawled": "2026-04-06" },
    { "url": "/articles/ai-agent-security-risks.html", "googleIndexed": true, "bingIndexed": false, "lastCrawled": "2026-04-05" }
  ]
}